{
  "$schema": "https://json-schema.org/draft/2020-12/schema",
  "$id": "https://example.com/sources.schema.json",
  "title": "Sources",
  "type": "array",
  "items": {
    "type": "object",
    "required": ["provider", "urls", "asns"],
    "properties": {
      "provider": { "type": "string", "minLength": 1 },
      "urls": {
        "type": "array",
        "items": { "type": "string", "minLength": 1 }
      },
      "asns": {
        "type": "array",
        "items": { "type": "string", "pattern": "^AS\\d+$" }
      },
      "static_ips": {
        "type": "array",
        "items": { "type": "string", "minLength": 1 }
      },
      "note": { "type": "string" }
    },
    "additionalProperties": false
  }
}
