[
  {
    "provider": "Akamai",
    "urls": [
      "https://techdocs.akamai.com/property-manager/pdfs/akamai_ipv4_CIDRs.txt",
      "https://techdocs.akamai.com/property-manager/pdfs/akamai_ipv6_CIDRs.txt"
    ],
    "asns": [
      "AS12222",
      "AS133103",
      "AS16625",
      "AS16702",
      "AS17204",
      "AS18680",
      "AS18717",
      "AS20189",
      "AS20940",
      "AS21342",
      "AS21357",
      "AS21399",
      "AS22207",
      "AS22452",
      "AS23454",
      "AS23455",
      "AS23903",
      "AS24319",
      "AS26008",
      "AS30675",
      "AS31107",
      "AS31108",
      "AS31109",
      "AS31110",
      "AS31377",
      "AS33047",
      "AS33905",
      "AS34164",
      "AS34850",
      "AS35204",
      "AS35993",
      "AS35994",
      "AS36183",
      "AS393560",
      "AS39836",
      "AS43639",
      "AS55409",
      "AS55770",
      "AS63949"
    ],
    "static_ips": []
  },
  {
    "provider": "ArvanCloud",
    "urls": [
      "https://www.arvancloud.ir/en/ips.txt"
    ],
    "asns": [],
    "static_ips": []
  },
  {
    "provider": "BelugaCDN",
    "urls": [],
    "asns": [],
    "static_ips": [
      "45.32.205.194",
      "45.32.171.136",
      "207.148.103.72",
      "45.32.139.246",
      "155.138.163.55",
      "136.244.96.178",
      "149.28.228.141",
      "95.179.211.233",
      "149.248.35.160",
      "155.138.145.126",
      "45.32.79.109",
      "45.76.135.107",
      "139.180.212.85",
      "141.164.34.103",
      "149.28.189.219",
      "149.28.118.26",
      "104.207.131.132"
    ],
    "note": "No official public IP list URL. IPv4 addresses provided by BelugaCDN via direct correspondence."
  },
  {
    "provider": "Bunny",
    "urls": [],
    "asns": [
      "AS200325"
    ],
    "static_ips": []
  },
  {
    "provider": "CacheFly",
    "urls": [
      "https://cachefly.cachefly.net/ips/cdn.txt"
    ],
    "asns": [],
    "static_ips": []
  },
  {
    "provider": "CDN77",
    "urls": [
      "https://prefixlists.tools.cdn77.com/public_lmax_prefixes.json"
    ],
    "asns": [],
    "static_ips": []
  },
  {
    "provider": "CDNetworks",
    "urls": [],
    "asns": [
      "AS36408"
    ],
    "static_ips": []
  },
  {
    "provider": "Cloudflare",
    "urls": [
      "https://www.cloudflare.com/ips-v4/",
      "https://www.cloudflare.com/ips-v6/"
    ],
    "asns": [],
    "static_ips": []
  },
  {
    "provider": "CloudFront",
    "urls": [
      "https://ip-ranges.amazonaws.com/ip-ranges.json"
    ],
    "asns": [],
    "static_ips": []
  },
  {
    "provider": "DDoS-Guard",
    "urls": [],
    "asns": [
      "AS57724"
    ],
    "static_ips": []
  },
  {
    "provider": "Derak Cloud",
    "urls": [
      "https://api.derak.cloud/public/ipv4",
      "https://api.derak.cloud/public/ipv6"
    ],
    "asns": [],
    "static_ips": []
  },
  {
    "provider": "Edgecast",
    "urls": [],
    "asns": [
      "AS15133"
    ],
    "static_ips": []
  },
  {
    "provider": "EdgeNext",
    "urls": [],
    "asns": [
      "AS139057",
      "AS149981"
    ],
    "static_ips": []
  },
  {
    "provider": "Edgio",
    "urls": [],
    "asns": [
      "AS60261"
    ],
    "static_ips": []
  },
  {
    "provider": "F5",
    "urls": [
      "https://docs.cloud.f5.com/docs-v2/platform/reference/network-cloud-ref"
    ],
    "asns": [],
    "static_ips": []
  },
  {
    "provider": "Fastly",
    "urls": [
      "https://api.fastly.com/public-ip-list"
    ],
    "asns": [],
    "static_ips": []
  },
  {
    "provider": "Gcore",
    "urls": [
      "https://api.gcore.com/cdn/public-ip-list"
    ],
    "asns": [],
    "static_ips": []
  },
  {
    "provider": "Google Cloud",
    "urls": [
      "https://www.gstatic.com/ipranges/cloud.json"
    ],
    "asns": [],
    "static_ips": []
  },
  {
    "provider": "Imperva",
    "urls": [
      "https://my.imperva.com/api/integration/v1/ips"
    ],
    "asns": [],
    "static_ips": []
  },
  {
    "provider": "IranServer",
    "urls": [
      "https://ips.f95.com/ip.txt"
    ],
    "asns": [],
    "static_ips": []
  },
  {
    "provider": "Leaseweb",
    "urls": [
      "https://networksdb.io/ip-addresses-of/leaseweb-cdn-bv"
    ],
    "asns": [],
    "static_ips": []
  },
  {
    "provider": "Limelight",
    "urls": [],
    "asns": [
      "AS22822"
    ],
    "static_ips": []
  },
  {
    "provider": "Medianova",
    "urls": [
      "https://cloud.medianova.com/api/v1/ip/blocks-list"
    ],
    "asns": [],
    "static_ips": []
  },
  {
    "provider": "Microsoft Azure",
    "urls": [
      "https://www.microsoft.com/en-us/download/details.aspx?id=56519"
    ],
    "asns": [],
    "static_ips": []
  },
  {
    "provider": "ParsPack",
    "urls": [
      "https://parspack.com/cdnips.txt"
    ],
    "asns": [],
    "static_ips": []
  },
  {
    "provider": "Qrator",
    "urls": [],
    "asns": [
      "AS200449"
    ],
    "static_ips": []
  },
  {
    "provider": "StackPath",
    "urls": [],
    "asns": [
      "AS12989"
    ],
    "static_ips": []
  },
  {
    "provider": "StormWall",
    "urls": [],
    "asns": [
      "AS59796"
    ],
    "static_ips": []
  },
  {
    "provider": "Sucuri",
    "urls": [],
    "asns": [
      "AS30148"
    ],
    "static_ips": []
  },
  {
    "provider": "X4B",
    "urls": [],
    "asns": [
      "AS136165"
    ],
    "static_ips": []
  },
  {
    "provider": "Alibaba Cloud CDN",
    "urls": [],
    "asns": [],
    "static_ips": [],
    "note": "No public IP/ASN published."
  },
  {
    "provider": "Azion",
    "urls": [],
    "asns": [],
    "static_ips": [],
    "note": "No public IP/ASN published."
  },
  {
    "provider": "BaishanCloud",
    "urls": [],
    "asns": [],
    "static_ips": [],
    "note": "No public IP/ASN published."
  },
  {
    "provider": "ChinaCache (QUANTIL)",
    "urls": [],
    "asns": [],
    "static_ips": [],
    "note": "No public IP/ASN published."
  },
  {
    "provider": "Huawei Cloud CDN",
    "urls": [],
    "asns": [],
    "static_ips": [],
    "note": "No public IP/ASN published."
  },
  {
    "provider": "KeyCDN",
    "urls": [],
    "asns": [],
    "static_ips": [],
    "note": "No public IP/ASN published."
  },
  {
    "provider": "OVHcloud CDN",
    "urls": [],
    "asns": [],
    "static_ips": [],
    "note": "No public IP/ASN published."
  },
  {
    "provider": "Tencent Cloud CDN",
    "urls": [],
    "asns": [],
    "static_ips": [],
    "note": "No public IP/ASN published."
  },
  {
    "provider": "CDNsun",
    "urls": [],
    "asns": [],
    "static_ips": [],
    "note": "IP list available via paid API; no public IP ranges."
  }
]